{
  "$schema": "../schemas/location.schema.json",
  "id": "beach",
  "mapName": "Beach",
  "background": "#bae6fd",
  "musicPath": "",
  "ambiencePath": "",
  "playerSpawnPoint": "path",
  "playerSpawns": {
    "path": { "x": 3, "y": 7 }
  },
  "npcSpawnPoints": {},
  "map": {
    "legend": {
      ".": { "color": "#fde68a" },
      "#": { "color": "#92400e", "blocked": true },
      "w": { "color": "#0ea5e9", "blocked": true, "decoration": "water" }
    },
    "tiles": [
      "########################",
      "#.....................w#",
      "#...................www#",
      "#.................wwwww#",
      "#...............wwwwwww#",
      "#.............wwwwwwwww#",
      "#...........wwwwwwwwwww#",
      "#.........wwwwwwwwwwwww#",
      "#.......wwwwwwwwwwwwwww#",
      "#.....wwwwwwwwwwwwwwwww#",
      "#...wwwwwwwwwwwwwwwwwww#",
      "#.wwwwwwwwwwwwwwwwwwwww#",
      "#.wwwwwwwwwwwwwwwwwwwww#",
      "#......................#",
      "########################"
    ]
  },
  "exits": [],
  "props": [
    { "x": 6, "y": 5, "width": 12, "height": 8, "color": "#f97316", "outline": "#9a3412", "label": "TOWEL" },
    { "x": 11, "y": 4, "width": 8, "height": 20, "color": "#facc15", "outline": "#854d0e", "label": "SUN" },
    { "x": 15, "y": 6, "width": 20, "height": 10, "color": "#38bdf8", "outline": "#075985", "label": "OCEAN" }
  ]
}
